[
  {
    "id": "J1-flow-input-to-sediment",
    "dimension": "flow",
    "source_type": "flow",
    "input": "[fixture-based] 上游：capture 写出 00_inbox/ideas/YYYYMMDD-HHMM-rag-chunking.md（capture_type=idea, title=rag chunking 大小影响检索召回, 正文含 chunk_size=512 经验）\n下游：运行 ingest，检查产物。",
    "user_choice": null,
    "expected": {
      "should_trigger_capture": true,
      "path_glob": "02_areas/ai-engineering/*rag-chunking*.md",
      "frontmatter": {"type": "^concept$", "maturity": "^seedling$", "confidence": ".+"},
      "frontmatter_forbidden": [],
      "content_contains": ["chunk_size"],
      "content_excludes": [],
      "should_trigger_polish": false,
      "feedback_contains": [],
      "flow_upstream_file": "bench/cases/flow/fixtures/J1-capture-idea-rag-chunking.json",
      "flow_downstream_check": {
        "skill": "ingest",
        "consume_field": "capture_type",
        "produce_field": "type"
      }
    },
    "category": "flow",
    "references": ["capture §5 + ingest §3"],
    "notes": "J1 输入→沉淀：capture 的 frontmatter 字段名/值被 ingest 正确消费"
  },
  {
    "id": "J2-flow-sediment-to-goal",
    "dimension": "flow",
    "source_type": "flow",
    "input": "[fixture-based] 上游：J1 产出的 atom 02_areas/ai-engineering/rag-chunking.md\n下游：运行 goal，建立 03_goals/learn-rag/goal.md（含「学习路径」「相关笔记」段）。",
    "user_choice": null,
    "expected": {
      "should_trigger_capture": true,
      "path_glob": "03_goals/learn-rag/goal.md",
      "frontmatter": {},
      "frontmatter_forbidden": [],
      "content_contains": ["rag-chunking"],
      "content_excludes": [],
      "should_trigger_polish": false,
      "feedback_contains": [],
      "flow_upstream_file": "bench/cases/flow/fixtures/J2-atom-rag-chunking.json",
      "flow_downstream_check": {
        "skill": "goal",
        "consume_field": "type",
        "produce_field": "学习路径"
      }
    },
    "category": "flow",
    "references": ["goal §4 工作流·create + §8 输出示例"],
    "notes": "J2 沉淀→目标：goal.md 含「学习路径」段 wikilinks；goal SKILL 不产 frontmatter references 字段，引用通过正文 wikilinks 表达"
  },
  {
    "id": "J3-flow-goal-to-execution",
    "dimension": "flow",
    "source_type": "flow",
    "input": "[fixture-based] 上游：J2 的 goal + atom\n下游：运行 project，写 04_projects/rag-poc/decisions/YYYY-MM-DD-chunk-size.md。",
    "user_choice": null,
    "expected": {
      "should_trigger_capture": true,
      "path_glob": "04_projects/rag-poc/decisions/*chunk-size*.md",
      "frontmatter": {"outcome": ".+"},
      "frontmatter_forbidden": [],
      "content_contains": ["goal"],
      "content_excludes": [],
      "should_trigger_polish": false,
      "feedback_contains": [],
      "flow_upstream_file": "bench/cases/flow/fixtures/J3-goal-and-atom.json",
      "flow_downstream_check": {
        "skill": "project",
        "consume_field": "references",
        "produce_field": "outcome"
      }
    },
    "category": "flow",
    "references": ["project §3 init + §4 archive Decision Ledger"],
    "notes": "J3 目标→执行：project decisions/*.md 是 Decision Ledger 个体记录（含 outcome 字段）；context 字段属于项目 _readme.md，不在 decision 文件里"
  },
  {
    "id": "J4-flow-execution-to-output",
    "dimension": "flow",
    "source_type": "flow",
    "input": "[fixture-based] 上游：J3 的 decision\n下游：运行 daily，写 05_outputs/daily/YYYY/MM/YYYY-MM-DD.md。",
    "user_choice": null,
    "expected": {
      "should_trigger_capture": true,
      "path_glob": "05_outputs/daily/*/*.md",
      "frontmatter": {},
      "frontmatter_forbidden": [],
      "content_contains": ["[[", "]]"],
      "content_excludes": [],
      "should_trigger_polish": false,
      "feedback_contains": [],
      "flow_upstream_file": "bench/cases/flow/fixtures/J4-decision-chunk-size.json",
      "flow_downstream_check": {
        "skill": "daily",
        "consume_field": "context",
        "produce_field": "wikilinks"
      }
    },
    "category": "flow",
    "references": ["daily §3 + SKILLS_SPEC §8"],
    "notes": "J4 执行→产出：daily 识别 project 进展，wikilink 指向 project 或 decision"
  },
  {
    "id": "J5-flow-output-to-index",
    "dimension": "flow",
    "source_type": "flow",
    "input": "[fixture-based] 上游：J4 的 daily\n下游：运行 connect，更新 06_wiki/mocs/rag-architecture.md。",
    "user_choice": null,
    "expected": {
      "should_trigger_capture": true,
      "path_glob": "06_wiki/mocs/*rag*.md",
      "frontmatter": {},
      "frontmatter_forbidden": [],
      "content_contains": ["[[", "]]"],
      "content_excludes": [],
      "should_trigger_polish": false,
      "feedback_contains": [],
      "flow_upstream_file": "bench/cases/flow/fixtures/J5-daily-rag.json",
      "flow_downstream_check": {
        "skill": "connect",
        "consume_field": "wikilinks",
        "produce_field": "moc"
      }
    },
    "category": "flow",
    "references": ["connect §4 步骤 3 MOC 生成 + §4 步骤 6 反馈输出"],
    "notes": "J5 产出→索引：connect 产 06_wiki/mocs/<domain>-moc.md，正文为该领域 atom 的 wikilinks 聚类清单；moc_entries 不是 frontmatter 字段，契约通过正文 wikilinks `[[ ]]` 验证"
  },
  {
    "id": "J6-flow-index-to-system",
    "dimension": "flow",
    "source_type": "flow",
    "input": "[fixture-based] 上游：J5 的 MOC + atom\n下游：运行 review/archive/stats 系统层扫描。",
    "user_choice": null,
    "expected": {
      "should_trigger_capture": true,
      "path_glob": "05_outputs/reviews/*/*.md",
      "frontmatter": {},
      "frontmatter_forbidden": [],
      "content_contains": ["健康"],
      "content_excludes": [],
      "should_trigger_polish": false,
      "feedback_contains": [],
      "flow_upstream_file": "bench/cases/flow/fixtures/J6-moc-and-atom.json",
      "flow_downstream_check": {
        "skill": "review",
        "consume_field": "moc_entries",
        "produce_field": "health_report"
      }
    },
    "category": "flow",
    "references": ["review §4 步骤 3 四维度分析 + §5.2 报告结构"],
    "notes": "J6 索引→系统：review 产 05_outputs/reviews/weekly/YYYY-Wxx.md，正文含「健康指标表 + 维度详情 + 待办清单」；review SKILL v0.2 显式禁用 maturity（自检清单要求无 maturity 出现），改测健康指标"
  }
]
